{
  "_license": "SPDX-License-Identifier: AGPL-3.0-only\nCopyright (C) 2026 Motion Master\nThis directory is a separate AGPL-3.0 work that talks to a Montage instance\nover its public HTTP/MCP interfaces. It is NOT part of the proprietary\nMotion Master product and is excluded from its licence by design.",
  "cuts": [
    {
      "id": "cut-open",
      "source": "assets/video/source.mp4",
      "in_seconds": 0,
      "out_seconds": 3,
      "source_in_seconds": 0,
      "animation": "ken-burns",
      "layer": "primary"
    },
    {
      "id": "cut-hold",
      "source": "assets/video/source.mp4",
      "in_seconds": 3,
      "out_seconds": 16,
      "source_in_seconds": 3,
      "animation": "ken-burns",
      "layer": "primary"
    }
  ],
  "overlays": [
    {
      "type": "hero_title",
      "in_seconds": 3,
      "out_seconds": 14,
      "text": "MOTION MASTER",
      "subtitle": "Your footage, in motion"
    },
    {
      "type": "section_title",
      "in_seconds": 3,
      "out_seconds": 16,
      "text": "SOURCE FOOTAGE",
      "accentColor": "#FF4A1C",
      "position": "top-left"
    }
  ],
  "themeConfig": {
    "primaryColor": "#111113",
    "accentColor": "#FF4A1C",
    "backgroundColor": "#F4F4F2",
    "surfaceColor": "#FFFFFF",
    "textColor": "#111113",
    "mutedTextColor": "#6B6B70",
    "headingFont": "IBM Plex Sans",
    "bodyFont": "IBM Plex Sans",
    "monoFont": "IBM Plex Mono",
    "chartColors": [
      "#FF4A1C",
      "#111113",
      "#6B6B70",
      "#D63A12"
    ]
  }
}
