{
  "_license": "SPDX-License-Identifier: AGPL-3.0-only\nCopyright (C) 2026 Motion Master\nThis directory is a separate AGPL-3.0 work that talks to a Montage instance over its public HTTP/MCP interfaces. It is NOT part of the proprietary Motion Master product and is excluded from its licence by design.",
  "cuts": [
    {
      "id": "cut-open",
      "source": "assets/video/source.mp4",
      "in_seconds": 0,
      "out_seconds": 4,
      "source_in_seconds": 0,
      "animation": "ken-burns",
      "layer": "primary"
    },
    {
      "id": "cut-hold",
      "source": "assets/video/source.mp4",
      "in_seconds": 4,
      "out_seconds": 10,
      "source_in_seconds": 4,
      "animation": "ken-burns",
      "layer": "primary"
    }
  ],
  "overlays": [
    {
      "type": "hero_title",
      "in_seconds": 4,
      "out_seconds": 9,
      "text": "A VALID TIMELINE",
      "subtitle": "everything checks out"
    }
  ],
  "themeConfig": {
    "primaryColor": "#111113",
    "accentColor": "#FF4A1C",
    "backgroundColor": "#F4F4F2",
    "surfaceColor": "#FFFFFF",
    "textColor": "#111113",
    "mutedTextColor": "#6B6B70",
    "headingFont": "IBM Plex Sans",
    "bodyFont": "IBM Plex Sans",
    "monoFont": "IBM Plex Mono"
  }
}
